{"counts":{"assessment_access_count":0,"attempt_count":1,"development_access_count":0,"expensive_operation_count":0,"label_access_count":0,"prebundle_access_count":1},"payload":{},"primary_error":{"message":"launch manifest differs from preregistered authority","type":"ValueError"},"schema_version":"cft-revival.experiment-terminal/1.0.0","secondary_errors":[],"state":"prebundle_failure"}